pregunta,a,b,c,d,correcta,materia,tema
La ecuación de la tangente a la curva y = √x en el punto donde x=4 es:,x - 4y + 4 = 0,4x - y - 4 = 0,x - 4y - 4 = 0,4x - y + 4 = 0,a,Matemáticas,La derivada
Si la posición de una partícula es s(t)=t² - 4t + 3 (t≥0)| ¿en qué instante cambia de dirección (velocidad cero)?,t=2,t=0,t=1,t=3,a,Matemáticas,La derivada
Los intervalos donde f(x)=x³ - 6x² + 9x + 1 es creciente son:,(-∞ 1) U (3 ∞),(-∞ 1] U [3 ∞),(1 3),(-∞ ∞),a,Matemáticas,La derivada
El valor mínimo absoluto de f(x)=x⁴ - 8x² + 16 en el intervalo [-1 3] es:,0,7,16,-9,a,Matemáticas,La derivada
Los puntos de inflexión de f(x)=x⁴ - 4x³ se encuentran en:,x=0 y x=2,x=0,x=2,x=3,a,Matemáticas,La derivada
Se desea construir una caja con base cuadrada y abierta por arriba| con 300 cm² de material. La longitud del lado de la base que maximiza el volumen es:,10 cm,5√6 cm,10√2 cm,15 cm,a,Matemáticas,La derivada
La integral ∫(2x-1)^50 dx es:,(1/102)(2x-1)^51 + C,(1/51)(2x-1)^51 + C,50(2x-1)^49 + C,(1/50)(2x-1)^50 + C,a,Matemáticas,La integral
El valor de la integral definida ∫_{-1}^{1} (x³ + 2x) dx es:,0,1,2,4,a,Matemáticas,La integral
La integral ∫ x² e^{x³} dx es:,(1/3) e^{x³} + C,e^{x³} + C,3 e^{x³} + C,x³ e^{x³} + C,a,Matemáticas,La integral
Aplicando el método de integración por partes a ∫ x ln(x) dx (con u=ln x)| el resultado es:,(x²/2) ln x - (x²/4) + C,x ln x - x + C,(1/2)(ln x)² + C,x² ln x - x² + C,a,Matemáticas,La integral
La integral ∫ cos(3x) sen(3x) dx es:,-(1/6) cos²(3x) + C,(1/6) sen²(3x) + C,(1/2) sen(6x) + C,-(1/12) cos(6x) + C,a,Matemáticas,La integral
La integral ∫ dx / (x ln x) es:,ln|ln x| + C,1/(ln x)² + C,ln x + C,1/x + C,a,Matemáticas,La integral
El área de la región limitada por la curva y = 4 - x² y el eje X es:,32/3,16/3,64/3,8,a,Matemáticas,La integral
Si F'(x) = 3x² - 2x y F(1)=4| entonces F(2) es igual a:,6,8,10,12,a,Matemáticas,La integral
El resultado de sumar los números complejos (1+2i)| (-3+i) y (2-4i) es:,0 - i,6 - i,0 + 7i,-2 - i,a,Matemáticas,Operaciones con núm. reales complejos y expr. algebraicas
El módulo del producto (3+4i)(3-4i) es:,25,5,7,1,a,Matemáticas,Operaciones con núm. reales complejos y expr. algebraicas
Al simplificar la expresión (a² - b²)/(a-b) para a≠b| se obtiene:,a+b,a-b,1,(a²+b²)/(a-b),a,Matemáticas,Operaciones con núm. reales complejos y expr. algebraicas
El término central en el desarrollo de (x + 1/x)^6 es:,20,15,6,1,a,Matemáticas,Productos notables y factorización
Si al dividir P(x)=x³ - 4x² + kx - 8 entre (x-2) el residuo es 0| entonces k vale:,6,4,2,8,a,Matemáticas,Productos notables y factorización
La ecuación (2x-1)(x+3)=0 tiene por conjunto solución:,\{1/2, -3\},\{-1/2, 3\},\{0.5, 3\},\{-0.5, -3\},a,Matemáticas,Ecuaciones
El discriminante de la ecuación mx² + 2x + 1 = 0 es 0. El valor de m es:,1,2,1/2,4,a,Matemáticas,Ecuaciones
La solución de la desigualdad -2x + 5 ≤ 3x + 10 es:,x ≥ -1,x ≤ -1,x ≥ 1,x ≤ 1,a,Matemáticas,Desigualdades
El sistema { x + 2y = 4; 2x + 4y = 8 } es:,Dependiente (infinitas soluciones),Independiente (solución única),Inconsistente (sin solución),Homogéneo,a,Matemáticas,Sistemas de ecuaciones
¿Cuál de las siguientes NO es una función? ,y = ±√x,y = x²,y = 2x+1,y = |x|,a,Matemáticas,Funciones algebraicas
La función f(x)=1 si x es racional|0 si x es irracional| es:,Discontinua en todo punto,Continua en los racionales,Continua en 0,Continua en los irracionales,a,Matemáticas,Funciones algebraicas
La operación (f * g)(x) si f(x)=x-1 y g(x)=x+1 es:,(x-1)(x+1)=x²-1,x-1+x+1=2x,(x-1)/(x+1),1,a,Matemáticas,Funciones algebraicas
La expresión sen(π/2 + θ) es igual a:,cos θ,-cos θ,sen θ,-sen θ,a,Matemáticas,Trigonometría y Funciones Trigonométricas
La función y = 2 sen(x - π/4) tiene un desplazamiento de fase de:,π/4 a la derecha,π/4 a la izquierda,π/2 a la derecha,π/2 a la izquierda,a,Matemáticas,Trigonometría y Funciones Trigonométricas
El rango de la función f(x) = 2 + 3 cos(5x) es:,[-1 5],[-1 1],[2 5],[-3 3],a,Matemáticas,Trigonometría y Funciones Trigonométricas
La función f(x)=e^{-x} es:,Decreciente en todo su dominio,Creciente en todo su dominio,Constante,Par,a,Matemáticas,Funciones exponenciales y logarítmicas
La asíntota vertical de f(x)=ln(2-x) es:,x=2,x=0,y=2,y=0,a,Matemáticas,Funciones exponenciales y logarítmicas
La distancia del punto (3 5) a la recta y = 2x - 1 es:,0,√5,2,2/√5,a,Matemáticas,Geometría Analítica: Recta
La pendiente de la recta perpendicular a la que pasa por (1 2) y (4 8) es:,-1/2,-2,-1/6,-6,a,Matemáticas,Geometría Analítica: Recta
La ecuación de la mediana desde el vértice A(1 3) en un triángulo con B(-2 1) y C(4 5) es:,2x - 3y + 7 = 0,3x - 2y + 3 = 0,x + y - 4 = 0,2x + y - 5 = 0,a,Matemáticas,Geometría Analítica: Recta
El radio de la circunferencia x² + y² + 8x - 6y = 0 es:,5,√10,√13,25,a,Matemáticas,Geometría Analítica: Cónicas
El lado recto de la parábola (y-1)² = 12(x+2) mide:,12,6,3,24,a,Matemáticas,Geometría Analítica: Cónicas
La excentricidad de la elipse 16x² + 25y² = 400 es:,3/5,4/5,√41/5,5/3,a,Matemáticas,Geometría Analítica: Cónicas
La distancia entre los focos de la hipérbola x²/9 - y²/16 = 1 es:,10,8,6,2√7,a,Matemáticas,Geometría Analítica: Cónicas
La ecuación 4x² - y² - 8x + 6y - 1 = 0 representa una hipérbola. Su centro está en:,(1 3),(1 -3),(-1 3),(-1 -3),a,Matemáticas,Ecuación general de segundo grado
Para la ecuación Ax² + Bxy + Cy² + Dx + Ey + F = 0| si B² - 4AC = 0| la cónica es una:,Parábola,Elipse,Hipérbola,Circunferencia,a,Matemáticas,Ecuación general de segundo grado
El límite lim_{x→π/2} (tan x) es:,No existe (tiende a infinito),0,1,π/2,a,Matemáticas,Límites
El límite lim_{x→0} (e^x - 1)/x es:,1,0,e,No existe,a,Matemáticas,Límites
La función f(x)=|x-1|/(x-1) es discontinua en x=1. Esta discontinuidad es:,Por salto,Removible,Infinita,Evitable,a,Matemáticas,Límites
La derivada de f(x)=5 es:,0,5,5x,Indefinida,a,Matemáticas,La derivada
La derivada de f(x)=x² sen x es:,2x sen x + x² cos x,2x cos x,x² cos x,2x sen x - x² cos x,a,Matemáticas,La derivada
La derivada de f(x)=arctan(3x) es:,3/(1+9x²),1/(1+9x²),3/(1+x²),1/(1+3x²),a,Matemáticas,La derivada
Un punto crítico donde f'(x) no existe es llamado:,Punto singular,Punto estacionario,Punto de inflexión,Punto extremo,a,Matemáticas,La derivada
Si el ingreso marginal es la derivada de la función ingreso| entonces el ingreso por vender la unidad 101 se aproxima con:,R'(100),R(101)-R(100),R'(101),R(101),a,Matemáticas,La derivada
La integral ∫ sec²(5x) dx es:,(1/5) tan(5x) + C,tan(5x) + C,5 tan(5x) + C,sec(5x) tan(5x) + C,a,Matemáticas,La integral
La integral ∫ (x+1) / (x²+2x+5) dx se puede resolver con:,Sustitución u=x²+2x+5,Fracciones parciales,Integración por partes,Identidad trigonométrica,a,Matemáticas,La integral
El área entre las gráficas de y=x² y y=x³ en el intervalo [0 1] es:,1/12,1/6,1/4,1/3,a,Matemáticas,La integral
Si la velocidad de un móvil es v(t)=3t²-2t+1 y en t=0 está en s=2| la posición en t=2 es:,8,6,10,4,a,Matemáticas,La integral
El valor promedio de la función f(x)=sen x en el intervalo [0 π] es:,2/π,1/π,0,1,a,Matemáticas,La integral